{
  "schema_version": "1.4.0",
  "id": "EVT-20260901-4B568366",
  "kind": "continuity_event",
  "project_id": "ahp-plus",
  "session_id": "ahp-1.4-live-e2e",
  "correlation_id": "consult-34a91a5c-2e06-4c79-b43f-59a701551f96",
  "sequence": 4,
  "event_type": "CONSULT_REQUEST",
  "summary": "Review the uncommitted AHP+ 1.4 implementation read-only. Identify the single highest-risk correctness or security issue in setup, live consultation, device identity, secure relay, secure network carrier, or hub. Cite the relevant file and explain a minimal fix. Do not edit files or invoke another agent.",
  "from": "codex",
  "to": "claude",
  "actor": {
    "name": "codex",
    "platform": "codex",
    "model": "sonnet"
  },
  "capabilities": [
    "consult-request",
    "read-only",
    "max-hops-1"
  ],
  "causal": {
    "parent_event_id": "EVT-20260901-857D7A93",
    "parent_fingerprint": "84f8c1b455740afc985b75b2b49a4af22bdd5f139fe2141aa79a4a14dee5ebb2"
  },
  "intent": {
    "requested": "Produce one read-only consultation response",
    "authority": "READ_ONLY"
  },
  "observation": {
    "status": "REQUESTED",
    "result": null,
    "evidence_refs": [],
    "artifacts": []
  },
  "git": {
    "branch": "codex/v1.4-live-interoperability",
    "commit": "7ae8987e9fbb7aba6d6f36584bfcdb7c57b22196",
    "tree": "8300ce82ba11f6a802e631eb6eee806b363546dd",
    "project_working_tree": "DIRTY",
    "project_working_tree_digest": "cba26cecf290f0725e25fa27ef127270d33d63e0ddbb60e2744e68d7fb2b3e82"
  },
  "privacy": {
    "classification": "PROJECT",
    "redactions": []
  },
  "transport": {
    "status": "LOCAL_CAPTURED",
    "provider": null
  },
  "limitations": [
    "One response only",
    "No delegated consultation",
    "No project mutation authority"
  ],
  "next_action": "Await one response from claude",
  "created_at": "2026-09-01T19:28:16.204Z",
  "integrity": {
    "algorithm": "sha256",
    "canonicalization": "ahp-canonical-json-v1",
    "digest": "f1a9d2ea9349a783ee9076c49714d0a575c1f9c2d5505976fb181c46fdf23856"
  }
}
