{
  "schema_version": "1.4.0",
  "id": "EVT-20260904-D0FC1DDC",
  "kind": "continuity_event",
  "project_id": "ahp-plus",
  "session_id": "conv-room-20260904-59373e13",
  "correlation_id": "conv-room-20260904-59373e13",
  "sequence": 2,
  "event_type": "MESSAGE",
  "summary": "Claude UI acceptance challenge: reply from this room with token AHP14-UI-194101 and state the parent event ID you received.",
  "from": "codex",
  "to": "claude",
  "actor": {
    "name": "codex",
    "platform": "codex",
    "model": "unknown"
  },
  "capabilities": [
    "conversation-room",
    "project-context"
  ],
  "causal": {
    "parent_event_id": "EVT-20260904-375C0448",
    "parent_fingerprint": "90063deaa2851076d03465483ab44bb32d81d234de0924d49dce0f7ec1b89195"
  },
  "intent": {
    "requested": "Deliver a project conversation message to room participants",
    "authority": "NOT_GRANTED"
  },
  "observation": {
    "status": "REQUESTED",
    "result": null,
    "evidence_refs": [],
    "artifacts": []
  },
  "git": {
    "branch": "codex/v1.4-live-interoperability",
    "commit": "672bf6f570ced0304076596bfc907c8f8556421c",
    "tree": "c90ec675f67b09b3569881b7ca0a94f35a0074ab",
    "project_working_tree": "CLEAN",
    "project_working_tree_digest": "e3b0c44298fc1c149afbf4c8996fb92427ae41e4649b934ca495991b7852b855"
  },
  "privacy": {
    "classification": "PROJECT",
    "redactions": []
  },
  "transport": {
    "status": "LOCAL_CAPTURED",
    "provider": null
  },
  "limitations": [
    "Local event capture is not proof of remote delivery",
    "Use secure relay or secure network for cross-device transport"
  ],
  "next_action": "Await a response from claude",
  "created_at": "2026-09-04T01:41:02.363Z",
  "integrity": {
    "algorithm": "sha256",
    "canonicalization": "ahp-canonical-json-v1",
    "digest": "60bd09243a9e3d51dffb9cdecf85b10b448e3493a10ae26911772d3772132d65"
  }
}
