{
  "schema_version": "1.3.0",
  "id": "EVT-20260901-282EAA5B",
  "kind": "continuity_event",
  "project_id": "ahp-plus",
  "session_id": "ahp-1.3-development",
  "correlation_id": "ahp-1.3-development",
  "sequence": 2,
  "event_type": "CAPABILITY_CHANGE",
  "summary": "AHP+ 1.3 adds authenticated relay delivery and receiver-created receipts",
  "from": "codex",
  "to": "human",
  "actor": {
    "name": "Codex",
    "platform": "codex",
    "model": "unknown"
  },
  "capabilities": [],
  "causal": {
    "parent_event_id": "EVT-20260901-C1BE17A5",
    "parent_fingerprint": "46294101ad4219b380099eb39ec2e37cea51daf89c3a9e0b8ee44522fd474232"
  },
  "intent": {
    "requested": "Continue with relay and receipt implementation",
    "authority": "USER_CONFIRMED"
  },
  "observation": {
    "status": "VERIFIED",
    "result": "Core now preserves the EVT fingerprint through an HMAC-authenticated RLY envelope, imports through an idempotent persistent file channel, and returns a separately sealed RCP receipt.",
    "evidence_refs": [
      "EVD-20260901-CC2F96E4"
    ],
    "artifacts": [
      "src/relay.mjs|schemas/relay-envelope.schema.json|schemas/relay-receipt.schema.json|docs/CONTINUITY_EVENTS.md"
    ]
  },
  "git": {
    "branch": "codex/v1.3-realtime-messaging",
    "commit": "7ae8987e9fbb7aba6d6f36584bfcdb7c57b22196",
    "tree": "8300ce82ba11f6a802e631eb6eee806b363546dd",
    "project_working_tree": "DIRTY",
    "project_working_tree_digest": "cad6177ccd4c353459ffb84d5f65212369938f878b3da4fa84b91789a11a42f0"
  },
  "privacy": {
    "classification": "PROJECT",
    "redactions": []
  },
  "transport": {
    "status": "LOCAL_CAPTURED",
    "provider": null
  },
  "limitations": [
    "Reference carrier is a protected local/shared file channel, not a hosted encrypted network relay",
    "HMAC proves the project-shared credential, not unique device, account, human, or model identity",
    "No commit, push, CI, tag, npm publication, or external 1.3 receiver validation yet"
  ],
  "next_action": "Review the local 1.3 relay slice, then request explicit commit and push authority if accepted",
  "created_at": "2026-09-01T17:19:32.091Z",
  "integrity": {
    "algorithm": "sha256",
    "canonicalization": "ahp-canonical-json-v1",
    "digest": "a965c4849e4d9c22160af811b07ec7064a48ff230586d2687dee700b335021ae"
  }
}
