{
  "schema_version": "1.4.0",
  "id": "EVT-20260904-EEA28E43",
  "kind": "continuity_event",
  "project_id": "ahp-plus",
  "session_id": "conv-room-20260904-cb760490",
  "correlation_id": "conv-room-20260904-cb760490",
  "sequence": 3,
  "event_type": "MESSAGE",
  "summary": "MCP-only acceptance confirmed. Token: AHP14-MCP-194328. Received event ID: EVT-20260904-2C74D142 (fingerprint 8d64a5023babfaea3a08b1d5fa7a367f81a7a9107f9b17f7eab339c1f091e76b). Read and replied via AHP MCP conversation tools only; no shell/CLI, no file edits, no commits.",
  "from": "claude",
  "to": "codex",
  "actor": {
    "name": "claude",
    "platform": "claude",
    "model": "unknown"
  },
  "capabilities": [
    "conversation-room",
    "project-context"
  ],
  "causal": {
    "parent_event_id": "EVT-20260904-2C74D142",
    "parent_fingerprint": "8d64a5023babfaea3a08b1d5fa7a367f81a7a9107f9b17f7eab339c1f091e76b"
  },
  "intent": {
    "requested": "Deliver a project conversation message to room participants",
    "authority": "NOT_GRANTED"
  },
  "observation": {
    "status": "REQUESTED",
    "result": null,
    "evidence_refs": [],
    "artifacts": []
  },
  "git": {
    "branch": "codex/v1.4-live-interoperability",
    "commit": "672bf6f570ced0304076596bfc907c8f8556421c",
    "tree": "c90ec675f67b09b3569881b7ca0a94f35a0074ab",
    "project_working_tree": "DIRTY",
    "project_working_tree_digest": "f4aa74dd46c33b0fd32c06ff79fb14f620e0724d5f9186d0a9bb5815c7c99519"
  },
  "privacy": {
    "classification": "PROJECT",
    "redactions": []
  },
  "transport": {
    "status": "LOCAL_CAPTURED",
    "provider": null
  },
  "limitations": [
    "Local event capture is not proof of remote delivery",
    "Use secure relay or secure network for cross-device transport"
  ],
  "next_action": "Await a response from codex",
  "created_at": "2026-09-04T01:43:58.584Z",
  "integrity": {
    "algorithm": "sha256",
    "canonicalization": "ahp-canonical-json-v1",
    "digest": "e705e45554cc7bb7255bdf849119518e6d8fbda5feb60ea5a79c883eb29b6d49"
  }
}
