{
  "schema_version": "1.2.0",
  "id": "EVT-20260901-36B1662E",
  "kind": "continuity_event",
  "project_id": "ahp-plus",
  "session_id": "ahp-1.2-update",
  "correlation_id": "ahp-1.2-update",
  "sequence": 5,
  "event_type": "VALIDATION",
  "summary": "AHP+ 1.2 passed the pushed cross-platform branch gate",
  "from": "github-actions",
  "to": "human",
  "actor": {
    "name": "GitHub-Actions",
    "platform": "github-actions",
    "model": "n-a"
  },
  "capabilities": [],
  "causal": {
    "parent_event_id": "EVT-20260901-225A3BEE",
    "parent_fingerprint": "be5bdf3ead58b3537fbf1f1bf44317c42544d5b10f63b6af0653bb92cc101043"
  },
  "intent": {
    "requested": "",
    "authority": "NOT_GRANTED"
  },
  "observation": {
    "status": "VERIFIED",
    "result": "Six CI jobs passed across Ubuntu, macOS, and Windows with Node.js 20 and 22",
    "evidence_refs": [
      "EVD-20260901-551BCD64"
    ],
    "artifacts": [
      ".github/workflows/validate.yml"
    ]
  },
  "git": {
    "branch": "codex/v1.2-field-hardening",
    "commit": "bbe25be73f401a39602dffd1c631e131fb6f4d8f",
    "tree": "3d6e7c39ba4009bbc19111bf071faa1081bd148d",
    "project_working_tree": "CLEAN",
    "project_working_tree_digest": "e3b0c44298fc1c149afbf4c8996fb92427ae41e4649b934ca495991b7852b855"
  },
  "privacy": {
    "classification": "PROJECT",
    "redactions": []
  },
  "transport": {
    "status": "LOCAL_CAPTURED",
    "provider": "github-actions"
  },
  "limitations": [
    "npm next publication and registry consumer receipt remain pending explicit authority"
  ],
  "next_action": "Request explicit authorization before publishing 1.2.0-dev.0 to npm next",
  "created_at": "2026-09-01T02:40:46.210Z",
  "integrity": {
    "algorithm": "sha256",
    "canonicalization": "ahp-canonical-json-v1",
    "digest": "7f334f408b091b16c037fbcc495a0569dd2aa3c9e3604164696e350cc14fcd73"
  }
}
