{
  "schema_version": "1.4.0",
  "id": "EVT-20260901-857D7A93",
  "kind": "continuity_event",
  "project_id": "ahp-plus",
  "session_id": "ahp-1.4-live-e2e",
  "correlation_id": "consult-772889a4-dd8d-488d-8872-2ad8103506f7",
  "sequence": 3,
  "event_type": "ERROR",
  "summary": "Claude consultation failed: Command failed: /Users/eljochuaxd/.local/bin/claude --print --output-format json --permission-mode plan --tools Read,Glob,Grep --no-session-persistence --max-budget-usd 1 You are answering one bounded AHP+ consultation from another AI platform.\n\nOperate read-only. Do not edit files, run network mutations, commit, push, publish, deploy, or start another consultation.\n\nInspect the repository when useful and answer only the question. Clearly separate verified observations from inference.\n\nOrigin: codex\n\nTarget: claude\n\nProject: ahp-plus\n\nGit branch: codex/v1.4-live-interoperability\n\nGit commit: 7ae8987e9fbb7aba6d6f36584bfcdb7c57b22196\n\nWorking tree: DIRTY\n\nChanged files:\nM CHANGELOG.md\n M README.es.md\n M README.md\n M SPECIFICATION.md\n M VERSION\n M docs/ARCHITECTURE.md\n M docs/CHANNELS_ES.md\n M docs/COMMANDS.md\n M docs/COMMANDS_BY_SURFACE_ES.md\n M docs/CONFORMANCE.md\n M docs/CONTINUITY_EVENTS.md\n M docs/MOBILE_AND_REMOTE.md\n M package.json\n M schemas/checkpoint.schema.json\n M schemas/continuity-event.schema.json\n M schemas/handoff.schema.json\n M schemas/lock.schema.json\n M schemas/manifest.schema.json\n M schemas/project-state.schema.json\n M schemas/record.schema.json\n M scripts/validate.mjs\n M src/adapters.mjs\n M src/cli.mjs\n M src/constants.mjs\n M src/events.mjs\n M src/root.mjs\n M src/state.mjs\n M src/upgrade.mjs\n M src/validation.mjs\n M templates/adapters/chatgpt/AHP_MOBILE.md\n M templates/adapters/claude/CLAUDE.fragment.md\n M templates/adapters/codex/.agents/skills/ahp/SKILL.md\n M templates/adapters/codex/.agents/skills/ahp/agents/openai.yaml\n M templates/adapters/cursor/ahp.md\n M templates/adapters/generic/AGENTS.fragment.md\n M templates/adapters/generic/AHP_INSTRUCTIONS.md\n M templates/adapters/opencode/ahp.md\n M tests/core.test.mjs\n M tests/helpers.mjs\n?? docs/LIVE_INTEROP_ES.md\n?? schemas/device-identity.schema.json\n?? schemas/relay-envelope.schema.json\n?? schemas/relay-receipt.schema.json\n?? schemas/secure-envelope.schema.json\n?? schemas/secure-receipt.schema.js\n[truncated by AHP+]",
  "from": "claude",
  "to": "codex",
  "actor": {
    "name": "claude",
    "platform": "claude",
    "model": "unknown"
  },
  "capabilities": [
    "consult-failure",
    "read-only",
    "max-hops-1"
  ],
  "causal": {
    "parent_event_id": "EVT-20260901-E133788F",
    "parent_fingerprint": "e38a5612ffdfcdbb74429d7cc63946e10485be4fa2590acf979f409a67e4614b"
  },
  "intent": {
    "requested": "Record the failed bounded consultation without claiming delivery",
    "authority": "READ_ONLY"
  },
  "observation": {
    "status": "REJECTED",
    "result": null,
    "evidence_refs": [],
    "artifacts": []
  },
  "git": {
    "branch": "codex/v1.4-live-interoperability",
    "commit": "7ae8987e9fbb7aba6d6f36584bfcdb7c57b22196",
    "tree": "8300ce82ba11f6a802e631eb6eee806b363546dd",
    "project_working_tree": "DIRTY",
    "project_working_tree_digest": "aaa539819291e3c1c71b7af6db2e6dbed7845dd0b3db130c847fc49d1a4f02d1"
  },
  "privacy": {
    "classification": "PROJECT",
    "redactions": []
  },
  "transport": {
    "status": "LOCAL_CAPTURED",
    "provider": "live-claude"
  },
  "limitations": [
    "No provider response was received",
    "No project mutation authority"
  ],
  "next_action": "Inspect provider availability and retry only if authorized",
  "created_at": "2026-09-01T19:27:53.235Z",
  "integrity": {
    "algorithm": "sha256",
    "canonicalization": "ahp-canonical-json-v1",
    "digest": "84f8c1b455740afc985b75b2b49a4af22bdd5f139fe2141aa79a4a14dee5ebb2"
  }
}
