{
  "schema_version": "1.4.0",
  "id": "EVT-20260901-642EE85A",
  "kind": "continuity_event",
  "project_id": "ahp-plus",
  "session_id": "ahp-1.4-live-e2e-minimal",
  "correlation_id": "consult-92ef246d-1daf-4975-a4eb-74922b924857",
  "sequence": 1,
  "event_type": "CONSULT_REQUEST",
  "summary": "Answer in one sentence: does this AHP+ consultation arrive as a read-only, one-hop request? Do not inspect files or use tools.",
  "from": "codex",
  "to": "claude",
  "actor": {
    "name": "codex",
    "platform": "codex",
    "model": "haiku"
  },
  "capabilities": [
    "consult-request",
    "read-only",
    "max-hops-1"
  ],
  "causal": {
    "parent_event_id": null,
    "parent_fingerprint": null
  },
  "intent": {
    "requested": "Produce one read-only consultation response",
    "authority": "READ_ONLY"
  },
  "observation": {
    "status": "REQUESTED",
    "result": null,
    "evidence_refs": [],
    "artifacts": []
  },
  "git": {
    "branch": "codex/v1.4-live-interoperability",
    "commit": "7ae8987e9fbb7aba6d6f36584bfcdb7c57b22196",
    "tree": "8300ce82ba11f6a802e631eb6eee806b363546dd",
    "project_working_tree": "DIRTY",
    "project_working_tree_digest": "cba26cecf290f0725e25fa27ef127270d33d63e0ddbb60e2744e68d7fb2b3e82"
  },
  "privacy": {
    "classification": "PROJECT",
    "redactions": []
  },
  "transport": {
    "status": "LOCAL_CAPTURED",
    "provider": null
  },
  "limitations": [
    "One response only",
    "No delegated consultation",
    "No project mutation authority"
  ],
  "next_action": "Await one response from claude",
  "created_at": "2026-09-01T19:29:59.166Z",
  "integrity": {
    "algorithm": "sha256",
    "canonicalization": "ahp-canonical-json-v1",
    "digest": "ad477aa6c3643cfd04ed25d618493a3f95d4720f209fa2536f500f28d56d6eaa"
  }
}
